{
  "schema": "declawd.synthid-trace/v1",
  "trace_id": "short-v1",
  "profile": {
    "id": "declawd.synthid-profile/v1",
    "file_sha256": "3fcb8947cc6e267a653196571d9e43434de405b2977838cf95167c94c0ac8e08"
  },
  "sequence_role": "generated_output_only",
  "tokenizer": {
    "model_id": "declawd/model-neutral-token-ids",
    "revision": "v1",
    "eos_token_id": null
  },
  "token_ids": [1, 2, 3],
  "expected": {
    "status": "insufficient_data",
    "token_count": 3,
    "candidate_context_count": 0,
    "first_eos_index": null,
    "repetition_excluded_count": 0,
    "eos_excluded_count": 0,
    "valid_context_count": 0,
    "g_value_one_count": 0,
    "weighted_g_value_sum": 0,
    "g_values": {"bit_length": 0, "byte_length": 0, "sha256": "e3b0c44298fc1c149afbf4c8996fb92427ae41e4649b934ca495991b7852b855"},
    "masks": {
      "repetition": {"bit_length": 0, "byte_length": 0, "sha256": "e3b0c44298fc1c149afbf4c8996fb92427ae41e4649b934ca495991b7852b855"},
      "eos": {"bit_length": 0, "byte_length": 0, "sha256": "e3b0c44298fc1c149afbf4c8996fb92427ae41e4649b934ca495991b7852b855"},
      "valid": {"bit_length": 0, "byte_length": 0, "sha256": "e3b0c44298fc1c149afbf4c8996fb92427ae41e4649b934ca495991b7852b855"}
    },
    "raw_score": null,
    "weighted_score": null
  }
}
