{
  "schema": "declawd.synthid-trace/v1",
  "trace_id": "eos-boundary-v1",
  "profile": {
    "id": "declawd.synthid-profile/v1",
    "file_sha256": "3fcb8947cc6e267a653196571d9e43434de405b2977838cf95167c94c0ac8e08"
  },
  "sequence_role": "generated_output_only",
  "tokenizer": {
    "model_id": "declawd/model-neutral-token-ids",
    "revision": "v1",
    "eos_token_id": 999
  },
  "token_ids": [10, 20, 30, 40, 50, 60, 999, 70, 80, 90],
  "expected": {
    "status": "scored",
    "token_count": 10,
    "candidate_context_count": 6,
    "first_eos_index": 6,
    "repetition_excluded_count": 0,
    "eos_excluded_count": 4,
    "valid_context_count": 2,
    "g_value_one_count": 24,
    "weighted_g_value_sum": 3684,
    "g_values": {"bit_length": 180, "byte_length": 23, "sha256": "51e9ac7b53d10cc64ef9206a0b1fcc569fbd74b5d2d3fd1b4fbca9cde813b9c4"},
    "masks": {
      "repetition": {"bit_length": 6, "byte_length": 1, "sha256": "8a8de823d5ed3e12746a62ef169bcf372be0ca44f0a1236abc35df05d96928e1"},
      "eos": {"bit_length": 6, "byte_length": 1, "sha256": "084fed08b978af4d7d196a7446a86b58009e636b611db16211b65a9aadff29c5"},
      "valid": {"bit_length": 6, "byte_length": 1, "sha256": "084fed08b978af4d7d196a7446a86b58009e636b611db16211b65a9aadff29c5"}
    },
    "raw_score": {"numerator": 24, "denominator": 60, "decimal": "0.400000000000"},
    "weighted_score": {"numerator": 3684, "denominator": 9570, "decimal": "0.384952978056"}
  }
}
